{
  "version": 1,
  "features": [
    {"id": "normalize", "description": "Inspect the normalize stage"}
  ],
  "routes": [
    {"id": "home", "path": "/"}
  ],
  "controls": [
    {"id": "copy-config", "selector": "#copy"}
  ],
  "downloads": [],
  "browser_assertions": [
    {"id": "page-stages", "description": "Arrow keys page stages"}
  ]
}
